{
  "$schema": "https://json-schema.org/draft/2020-12/schema",
  "$id": "task.schema.json",
  "title": "Agent Task",
  "description": "Schema for bounded task files in ops/agent/queue/. Each task is a self-contained work unit that an agent can execute from files alone, without prior chat context.",
  "type": "object",
  "required": ["id", "title", "status", "kind", "milestone", "summary", "scope", "verification", "escalate_if", "worker"],
  "properties": {
    "id": {
      "type": "string",
      "pattern": "^T[0-9]+$",
      "description": "Unique task ID, e.g. T001."
    },
    "title": {
      "type": "string",
      "minLength": 1
    },
    "status": {
      "type": "string",
      "enum": ["pending", "claimed", "done", "blocked", "failed", "budget_exhausted"]
    },
    "kind": {
      "type": "string",
      "enum": ["docs", "implementation", "research", "ops", "validation"],
      "description": "Task category. Extend this enum as new kinds emerge."
    },
    "milestone": {
      "type": "string",
      "description": "Milestone ID this task belongs to, e.g. M001."
    },
    "summary": {
      "type": "string",
      "description": "One-sentence description of what done means."
    },
    "scope": {
      "type": "object",
      "required": ["files"],
      "properties": {
        "files": {
          "type": "array",
          "items": { "type": "string" },
          "description": "Paths the worker is expected to read or modify."
        },
        "out_of_scope": {
          "type": "array",
          "items": { "type": "string" },
          "description": "Explicit boundaries. Worker must not touch these."
        }
      }
    },
    "context": {
      "type": "object",
      "description": "Context-loading hints so agents can budget their context window.",
      "properties": {
        "required_reads": {
          "type": "array",
          "items": { "type": "string" },
          "description": "Files the worker must read before starting. Listed in read order."
        },
        "optional_reads": {
          "type": "array",
          "items": { "type": "string" },
          "description": "Files useful but not required. Load if context budget allows."
        },
        "estimated_input_lines": {
          "type": "integer",
          "description": "Approximate total lines of required context. Multiply by ~40 for rough token estimate."
        },
        "decision_refs": {
          "type": "array",
          "items": { "type": "string" },
          "description": "Stable decision IDs (D*) that constrain this task."
        },
        "open_question_refs": {
          "type": "array",
          "items": { "type": "string" },
          "description": "Open question IDs (O*) that may block or shape this task."
        }
      }
    },
    "output": {
      "type": "object",
      "description": "What the worker should produce.",
      "properties": {
        "artifacts": {
          "type": "array",
          "items": { "type": "string" },
          "description": "Paths to files the worker should create or update."
        },
        "side_effects": {
          "type": "array",
          "items": { "type": "string" },
          "description": "Non-file outcomes (e.g. 'update catalog.json', 'propagate decision D42 to specs')."
        }
      }
    },
    "verification": {
      "type": "object",
      "required": ["commands", "acceptance"],
      "properties": {
        "commands": {
          "type": "array",
          "items": { "type": "string" },
          "description": "Shell commands to run after the task. All must exit 0."
        },
        "acceptance": {
          "type": "array",
          "items": { "type": "string" },
          "description": "Human-readable acceptance criteria."
        }
      }
    },
    "handoff": {
      "type": "object",
      "properties": {
        "must_read": {
          "type": "array",
          "items": { "type": "string" }
        },
        "notes": {
          "type": "array",
          "items": { "type": "string" }
        }
      }
    },
    "escalate_if": {
      "type": "array",
      "items": { "type": "string" },
      "minItems": 1,
      "description": "Conditions that should stop autonomous work and return control to a human."
    },
    "worker": {
      "type": "object",
      "properties": {
        "preferred_surface": {
          "type": "string",
          "enum": ["cursor", "claude"]
        },
        "unattended_surface": {
          "type": "string",
          "enum": ["cursor", "claude"]
        }
      }
    }
  },
  "additionalProperties": false
}
